{"schema":"https://debz.dev/schema/root-operation-completion-v1","version":1,"attempt_id":"6b6b6b6b6b6b6b6b6b6b6b6b6b6b6b6b6b6b6b6b6b6b6b6b6b6b6b6b6b6b6b6b","record_generation":9,"record_digest_sha256":"d277d90b369c7a6ff53016ab5acfc5835519814d9f5e634e7e9696650e399d9f","install_root":"/target","root_identity_sha256":"c0797cfb781b2ef9906fa086e9508363f4884c515c2423f377248d46865228a5","backend":"native","surface":"package_transaction","operation":"install","phase":"provenance","step":8,"mutation_started":true,"outcome":"succeeded","request_sha256":"1111111111111111111111111111111111111111111111111111111111111111","policy_sha256":"2222222222222222222222222222222222222222222222222222222222222222","authorization_sha256":"5555555555555555555555555555555555555555555555555555555555555555","program_sha256":"6666666666666666666666666666666666666666666666666666666666666666","plan_sha256":"3333333333333333333333333333333333333333333333333333333333333333","exact_lock":{"schema":"https://debz.dev/schema/exact-closure-lock-v2","version":2,"digest_sha256":"7777777777777777777777777777777777777777777777777777777777777777"},"database_generation_sha256":"8888888888888888888888888888888888888888888888888888888888888888","artifact_evidence_sha256":"9999999999999999999999999999999999999999999999999999999999999999","target_architecture":"amd64","foreign_architectures":["i386"],"reserved_unix":1700000000,"updated_unix":1700000042,"transaction_provenance":{"status":"already_present","schema":"https://debz.dev/schema/transaction-result-v1","document_sha256":"aaaaaaaaaaaaaaaaaaaaaaaaaaaaaaaaaaaaaaaaaaaaaaaaaaaaaaaaaaaaaaaa","detail":"published transaction provenance verified against the completed attempt"},"journal":{"status":"archived","document_sha256":"bbbbbbbbbbbbbbbbbbbbbbbbbbbbbbbbbbbbbbbbbbbbbbbbbbbbbbbbbbbbbbbb","detail":"transaction.complete was archived by the executor that finished the transaction"},"discharge":{"surface":"package_transaction","operation":"recover","request_sha256":"cccccccccccccccccccccccccccccccccccccccccccccccccccccccccccccccc"},"digest_sha256":"0a72cde5150c9dcb6bac2d6fa1f831b5fd1ee2720430af29261b8c15db5dfdb2"}